{
  "generatedAt": "2026-05-05T15:41:12.076Z",
  "sourceBundle": "artifacts/packaged-qa-evidence-bundle.json",
  "status": "BLOCKED",
  "summary": {
    "total": 52,
    "pass": 21,
    "fail": 0,
    "blocked": 31,
    "pending": 0,
    "missingEvidence": 0,
    "mismatchedEvidenceStatus": 0,
    "missingPlatform": 0,
    "byPlatform": {
      "macOS": {
        "total": 27,
        "pass": 21,
        "fail": 0,
        "blocked": 6,
        "pending": 0
      },
      "Windows": {
        "total": 25,
        "pass": 0,
        "fail": 0,
        "blocked": 25,
        "pending": 0
      }
    },
    "product": {
      "total": 42,
      "pass": 21,
      "fail": 0,
      "blocked": 21,
      "pending": 0
    },
    "externalDistribution": {
      "total": 10,
      "pass": 0,
      "fail": 0,
      "blocked": 10,
      "pending": 0
    },
    "productByPlatform": {
      "macOS": {
        "total": 22,
        "pass": 21,
        "fail": 0,
        "blocked": 1,
        "pending": 0
      },
      "Windows": {
        "total": 20,
        "pass": 0,
        "fail": 0,
        "blocked": 20,
        "pending": 0
      }
    },
    "externalDistributionByPlatform": {
      "macOS": {
        "total": 5,
        "pass": 0,
        "fail": 0,
        "blocked": 5,
        "pending": 0
      },
      "Windows": {
        "total": 5,
        "pass": 0,
        "fail": 0,
        "blocked": 5,
        "pending": 0
      }
    }
  },
  "productReadiness": {
    "status": "BLOCKED",
    "posture": "Do not prioritize signing/notarization work until core app quality, competitor parity, and packaged UX evidence are credible.",
    "sourceDocs": [
      "docs/competitor-parity-gates.md",
      "docs/evals/dictation-parity-launch-scorecard.md",
      "docs/evals/superwhisper-parity-audit-2026-04-09.md"
    ],
    "blockers": [
      "Competitor parity gates are not PASS; the launch rule in docs/competitor-parity-gates.md is NO-GO if any CP gate is not PASS.",
      "Dictation parity scorecard still depends on packaged app evidence, app-matrix insertion evidence, provider telemetry proof, command/snippet reliability evidence, language certification, latency trend evidence, and trust/recovery UX proof.",
      "The app still lacks packaged evidence for broad language breadth, translate-to-English mode, and user-facing file transcription.",
      "Manual UX screenshots/videos are still missing for the P0 first-run, permissions, recording, processing, transcript, retention, backup, licensing, provider routing, failure recovery, and platform-scope journeys."
    ],
    "laterReleaseBlockers": [
      "Apple signing and notarization remain required before release.",
      "Windows signing and SmartScreen validation remain required before release.",
      "Signed updater validation remains required before release."
    ],
    "optionalBacklog": [
      "Mouse-button shortcut controls remain optional parity backlog per docs/evals/superwhisper-parity-audit-2026-04-09.md; do not block private beta or GA on that item unless the launch scope changes."
    ]
  },
  "uxGates": [
    {
      "id": "first-run-orientation",
      "name": "First-run orientation",
      "status": "BLOCKED",
      "owner": "qa-release",
      "acceptance": "New user understands what Nautilus does, local-first posture, required permissions, and the fastest safe starting path.",
      "summary": {
        "total": 4,
        "pass": 2,
        "fail": 0,
        "blocked": 2,
        "pending": 0
      },
      "evidence": [
        {
          "platform": "macOS",
          "area": "Onboarding",
          "testCase": "Normal user onboarding completes and persists baseline settings",
          "status": "PASS",
          "evidence": "artifacts/qa/macos/onboarding-normal.md",
          "owner": "qa-macos",
          "evidenceExists": true,
          "evidenceStatusMatches": true
        },
        {
          "platform": "macOS",
          "area": "Onboarding",
          "testCase": "Power user onboarding completes and persists advanced storage/retention settings",
          "status": "PASS",
          "evidence": "artifacts/qa/macos/onboarding-power.md",
          "owner": "qa-macos",
          "evidenceExists": true,
          "evidenceStatusMatches": true
        },
        {
          "platform": "Windows",
          "area": "Onboarding",
          "testCase": "Normal user onboarding completes and persists baseline settings",
          "status": "BLOCKED",
          "evidence": "artifacts/qa/windows/onboarding-normal.md",
          "owner": "qa-windows",
          "evidenceExists": true,
          "evidenceStatusMatches": true
        },
        {
          "platform": "Windows",
          "area": "Onboarding",
          "testCase": "Power user onboarding completes and persists advanced storage/retention settings",
          "status": "BLOCKED",
          "evidence": "artifacts/qa/windows/onboarding-power.md",
          "owner": "qa-windows",
          "evidenceExists": true,
          "evidenceStatusMatches": true
        }
      ]
    },
    {
      "id": "os-permissions",
      "name": "OS permissions",
      "status": "BLOCKED",
      "owner": "qa-release",
      "acceptance": "Microphone, accessibility/input, screen/meeting-related permissions, and denial recovery are explained before and after system prompts.",
      "summary": {
        "total": 3,
        "pass": 2,
        "fail": 0,
        "blocked": 1,
        "pending": 0
      },
      "evidence": [
        {
          "platform": "macOS",
          "area": "Permissions",
          "testCase": "Microphone permission flow",
          "status": "PASS",
          "evidence": "artifacts/qa/macos/permissions-microphone.md",
          "owner": "qa-macos",
          "evidenceExists": true,
          "evidenceStatusMatches": true
        },
        {
          "platform": "macOS",
          "area": "Permissions",
          "testCase": "Accessibility permission flow",
          "status": "PASS",
          "evidence": "artifacts/qa/macos/permissions-accessibility.md",
          "owner": "qa-macos",
          "evidenceExists": true,
          "evidenceStatusMatches": true
        },
        {
          "platform": "Windows",
          "area": "Permissions",
          "testCase": "Microphone permission flow",
          "status": "BLOCKED",
          "evidence": "artifacts/qa/windows/permissions-microphone.md",
          "owner": "qa-windows",
          "evidenceExists": true,
          "evidenceStatusMatches": true
        }
      ]
    },
    {
      "id": "recording-visibility",
      "name": "Recording visibility",
      "status": "BLOCKED",
      "owner": "qa-release",
      "acceptance": "User can always tell whether audio is being captured, paused, stopped, or unavailable.",
      "summary": {
        "total": 6,
        "pass": 3,
        "fail": 0,
        "blocked": 3,
        "pending": 0
      },
      "evidence": [
        {
          "platform": "macOS",
          "area": "Capture",
          "testCase": "Dictation hotkey end-to-end",
          "status": "PASS",
          "evidence": "artifacts/qa/macos/capture-dictation-hotkey.md",
          "owner": "qa-macos",
          "evidenceExists": true,
          "evidenceStatusMatches": true
        },
        {
          "platform": "macOS",
          "area": "Capture",
          "testCase": "Meeting recording mic-only",
          "status": "PASS",
          "evidence": "artifacts/qa/macos/capture-meeting-mic.md",
          "owner": "qa-macos",
          "evidenceExists": true,
          "evidenceStatusMatches": true
        },
        {
          "platform": "macOS",
          "area": "Capture",
          "testCase": "Meeting recording with system audio (where available)",
          "status": "PASS",
          "evidence": "artifacts/qa/macos/capture-meeting-system-audio.md",
          "owner": "qa-macos",
          "evidenceExists": true,
          "evidenceStatusMatches": true
        },
        {
          "platform": "Windows",
          "area": "Capture",
          "testCase": "Dictation hotkey end-to-end",
          "status": "BLOCKED",
          "evidence": "artifacts/qa/windows/capture-dictation-hotkey.md",
          "owner": "qa-windows",
          "evidenceExists": true,
          "evidenceStatusMatches": true
        },
        {
          "platform": "Windows",
          "area": "Capture",
          "testCase": "Meeting recording mic-only",
          "status": "BLOCKED",
          "evidence": "artifacts/qa/windows/capture-meeting-mic.md",
          "owner": "qa-windows",
          "evidenceExists": true,
          "evidenceStatusMatches": true
        },
        {
          "platform": "Windows",
          "area": "Capture",
          "testCase": "Meeting recording with loopback/system audio",
          "status": "BLOCKED",
          "evidence": "artifacts/qa/windows/capture-meeting-system-audio.md",
          "owner": "qa-windows",
          "evidenceExists": true,
          "evidenceStatusMatches": true
        }
      ]
    },
    {
      "id": "meeting-processing-state",
      "name": "Meeting processing state",
      "status": "BLOCKED",
      "owner": "qa-release",
      "acceptance": "On stop, meeting status changes to processing immediately; spinner/detail state updates without manual modal reopen.",
      "summary": {
        "total": 2,
        "pass": 1,
        "fail": 0,
        "blocked": 1,
        "pending": 0
      },
      "evidence": [
        {
          "platform": "macOS",
          "area": "Capture",
          "testCase": "Meeting processing UX: immediate `processing` status + spinner + detail auto-refresh",
          "status": "PASS",
          "evidence": "artifacts/qa/macos/capture-processing-ux.md",
          "owner": "qa-macos",
          "evidenceExists": true,
          "evidenceStatusMatches": true
        },
        {
          "platform": "Windows",
          "area": "Capture",